{
  "$schema": "https://json-schema.org/draft/2020-12/schema",
  "$id": "daily-reporting/schemas/output",
  "title": "Daily Reporting Output",
  "description": "Output shape produced by daily-reporting. Machine-readable mirror of references/schemas/output-schema.md. See ./MAINTAINING.md for sync discipline.",
  "type": "object",
  "$comment": "daily-reporting produces (1) a human-readable report and (2) a structured state artifact for continuity.",
  "properties": {
    "schema_version": {
      "type": "string",
      "const": "1.0",
      "description": "Schema version identifier. See ./MAINTAINING.md."
    },
    "mode": {
      "type": "string",
      "enum": ["sod", "eod"],
      "description": "Reporting cycle. Use mode consistently for sod or eod; do not introduce a second field like report_type for the same concept."
    },
    "report_date": {
      "type": "string",
      "description": "ISO-8601 calendar date (YYYY-MM-DD)."
    },
    "timezone": {
      "type": "string",
      "description": "Effective-at-runtime IANA timezone."
    },
    "status": {
      "type": "string",
      "enum": ["draft", "final", "partial", "blocked"],
      "description": "High-level run status.",
      "$comment": "A populated missing_sources[] must be paired with a downgraded status ('partial', or 'blocked' when a required source is absent)."
    },
    "report_stage": {
      "type": "string",
      "enum": ["generated", "reviewed", "locked", "sent"],
      "description": "Where the report is in the review flow.",
      "$comment": "generated: draft produced, not yet reviewed. reviewed: reviewed (with or without edits) but not yet locked. locked: confirmed and locked for continuity. sent: locked final delivered to delivery_meta.final_destination."
    },
    "finalization_mode": {
      "type": "string",
      "enum": ["reviewed_locked", "auto_locked", "send_only"],
      "description": "Which finalization policy the deployment applied.",
      "$comment": "Echo of review_policy.finalization_mode (see ../policies/review-and-locking.md). Present once the report reaches 'locked' or 'sent'. report_stage and finalization_mode are orthogonal and must not be conflated."
    },
    "human_readable_report": {
      "type": "string",
      "description": "Polished narrative rendering of merged_context per the SOD/EOD templates.",
      "$comment": "May polish narrative slots. Three narrative slots are explicitly permitted to be polished/synthesized at draft time: {{priority_context_summary}} (SOD), {{proposed_focus_statement}} (SOD), {{day_verdict_summary}} (EOD). Every other slot must be rendered verbatim from the merged_context field named in the template's 'Slot-to-field reference' table. See output-schema.md 'Polish rule' and 'Polish-slot verification'."
    },
    "structured_state": { "$ref": "#/$defs/structured_state" },
    "delivery_meta": { "$ref": "#/$defs/delivery_meta" },
    "validation_meta": { "$ref": "#/$defs/validation_meta" }
  },
  "required": ["mode", "report_date", "timezone", "status", "report_stage", "human_readable_report", "structured_state"],
  "additionalProperties": true,
  "$defs": {
    "owner_type": {
      "type": "string",
      "enum": ["exec", "ea", "assistant"],
      "description": "Role identifier vocabulary. Canonical declaration lives in deployment-config-schema.md."
    },
    "participant": {
      "type": "object",
      "description": "Canonical participant shape mirror. Source-of-truth is deployment-config-schema.md.",
      "properties": {
        "name": { "type": "string" },
        "role": { "type": "string" },
        "owner_type": { "$ref": "#/$defs/owner_type" }
      },
      "required": ["name", "role", "owner_type"],
      "additionalProperties": false
    },
    "string_list": {
      "type": "array",
      "items": { "type": "string" }
    },
    "structured_state": {
      "type": "object",
      "description": "Structured state artifact written for continuity.",
      "$comment": "structured_state fields must be copied verbatim from merged_context. No re-wording, no new items, no synthesized narrative. If merged_context does not contain content for a structured_state field, omit the field or emit an empty array - never synthesize new content directly into structured_state.",
      "properties": {
        "mode": { "type": "string", "enum": ["sod", "eod"] },
        "report_date": { "type": "string" },
        "timezone": { "type": "string" },
        "status": {
          "type": "string",
          "enum": ["draft", "final", "partial", "blocked"]
        },
        "report_stage": {
          "type": "string",
          "enum": ["generated", "reviewed", "locked", "sent"]
        },
        "finalization_mode": {
          "type": "string",
          "enum": ["reviewed_locked", "auto_locked", "send_only"]
        },
        "confirmed_by": {
          "type": "string",
          "description": "Must match one of participants[].name in the same structured_state.",
          "$comment": "Identifies the specific person by display name, not the role."
        },
        "confirmed_role": {
          "$ref": "#/$defs/owner_type",
          "description": "Role under which the confirmation occurred.",
          "$comment": "Must match the owner_type of the participant whose name equals confirmed_by."
        },
        "confirmed_at": {
          "type": "string",
          "description": "ISO-8601 timestamp of confirmation."
        },
        "locked_at": {
          "type": "string",
          "description": "ISO-8601 timestamp of transition to report_stage: locked."
        },
        "participants": {
          "type": "array",
          "items": { "$ref": "#/$defs/participant" }
        },
        "priorities": {
          "$ref": "#/$defs/string_list",
          "description": "Verbatim copy of merged_context.priorities."
        },
        "carryovers": {
          "$ref": "#/$defs/string_list",
          "description": "Verbatim copy of merged_context.carryovers."
        },
        "dependencies": {
          "$ref": "#/$defs/string_list",
          "description": "Verbatim copy of merged_context.dependencies."
        },
        "risks": {
          "$ref": "#/$defs/string_list",
          "description": "Verbatim copy of merged_context.risks."
        },
        "unresolved_items": {
          "$ref": "#/$defs/string_list",
          "description": "Verbatim copy of merged_context.unresolved_items."
        },
        "completed_items": {
          "$ref": "#/$defs/string_list",
          "description": "Verbatim copy of merged_context.completed_items. EOD-primary."
        },
        "notes_for_next_cycle": {
          "$ref": "#/$defs/string_list",
          "description": "Verbatim copy of merged_context.notes_for_next_cycle."
        }
      },
      "additionalProperties": true
    },
    "delivery_meta": {
      "type": "object",
      "description": "Records the delivery destinations used for this run.",
      "$comment": "Keys echo deployment-config's delivery_policy with a naming adjustment: delivery_policy.draft_destination is recorded here as review_destination.",
      "properties": {
        "review_destination": {
          "type": "string",
          "description": "Destination identifier used for drafts and in-review revisions. Matches deployment_config.defaults.delivery_policy.draft_destination (renamed here to describe the runtime role of the surface)."
        },
        "final_destination": {
          "type": "string",
          "description": "Destination identifier used for locked finals. Matches deployment_config.defaults.delivery_policy.final_destination."
        }
      },
      "additionalProperties": true
    },
    "validation_meta": {
      "type": "object",
      "description": "Helps a client or tool understand non-fatal issues.",
      "properties": {
        "schema_version": {
          "type": "string",
          "description": "Schema version the run asserted for its output shape."
        },
        "warnings": {
          "type": "array",
          "items": { "type": ["string", "object"] },
          "description": "List of non-fatal warning entries surfaced during the run.",
          "$comment": "Warning shape is intentionally loose in v1: string or object. Runtimes may encode warnings as plain strings (e.g. the sod-reviewed-locked example uses an empty array) or richer objects."
        },
        "continuity_status": {
          "type": "string",
          "enum": ["available", "unavailable", "first_run"]
        },
        "missing_sources": {
          "type": "array",
          "items": { "$ref": "#/$defs/missing_source_entry" },
          "description": "Source families that did not return usable data for reasons other than being intentionally disabled.",
          "$comment": "Populate missing_sources[] only for case (b) in skills/daily-reporting/SKILL.md ('If data is missing') - connector error, timeout, auth failure, or invalid payload. Do not populate it for case (a) (zero items returned successfully) or case (c) (connector intentionally disabled). A populated missing_sources[] must be paired with a corresponding warnings[] entry and a downgraded status."
        }
      },
      "additionalProperties": true
    },
    "missing_source_entry": {
      "type": "object",
      "description": "Records one source family that did not contribute usable data.",
      "properties": {
        "source_family": {
          "type": "string",
          "enum": ["calendar", "email", "tasks", "meetings", "prior_state", "manual"],
          "description": "The affected source key. Must be one of the canonical source keys in deployment-config-schema.md §Source keys."
        },
        "reason": {
          "type": "string",
          "enum": ["error", "timeout", "auth_failure", "invalid_payload", "required_but_absent"],
          "description": "Why the source did not contribute.",
          "$comment": "error: connector returned an error. timeout: connector exceeded its retrieval window. auth_failure: authentication or authorization failed. invalid_payload: connector returned data that failed schema validation, including a corrupted prior locked state per ../policies/continuity-model.md. required_but_absent: source is marked required in the deployment config but was unreachable and no fallback exists."
        }
      },
      "required": ["source_family", "reason"],
      "additionalProperties": false
    }
  }
}
